-- undo_consolidate.sql
-- pg_regress tests for pgmnemo.undo_consolidate() — v0.14.1 P1-A
--
-- Coverage:
--   T1:  undo_consolidate() function exists
--   T2:  apply consolidate() on a 3-lesson near-dup cluster
--   T3:  2 members superseded after consolidation
--   T4:  canonical evidence_count = 3
--   T5:  2 SUPERSEDED_BY consolidation edges exist
--   T6:  edges carry prior_state='draft' (v0.14.1 P1-A recording)
--   T7:  dry-run undo reports 1 cluster (2 would-be-restored members)
--   T8:  dry-run is provably non-mutating — state unchanged
--   T9:  dry-run non-mutating — edges unchanged
--   T10: apply undo — 1 cluster returned
--   T11: after undo, 0 superseded in role
--   T12: after undo, all 4 lessons active
--   T13: canonical evidence_count reset to 1
--   T14: members restored to exact prior state 'draft'
--   T15: 0 consolidation edges remain
--   T16: second undo is idempotent (no-op for this role)
-- SPDX-License-Identifier: Apache-2.0
ALTER EXTENSION pgmnemo UPDATE TO '0.15.1';
NOTICE:  version "0.15.1" of extension "pgmnemo" is already installed
SET pgmnemo.gate_strict           = 'off';
SET pgmnemo.include_unverified    = 'on';
SET pgmnemo.track_recall_recency  = 'off';
-- ── T1: undo_consolidate() function exists ───────────────────────────────────
SELECT count(*) = 1 AS t1_undo_fn_exists
FROM pg_proc
JOIN pg_namespace ON pg_namespace.oid = pg_proc.pronamespace
WHERE nspname = 'pgmnemo' AND proname = 'undo_consolidate';
 t1_undo_fn_exists 
-------------------
 t
(1 row)

-- ── Setup: seed 3 near-duplicate lessons + 1 outlier ─────────────────────────
-- role='tc_undo_con', project_id=99997 — isolated from other tests.
-- Same embedding geometry as consolidate.sql but with distinct commit_shas.
DO $$
DECLARE
    _l1 BIGINT; _l2 BIGINT; _l3 BIGINT;
BEGIN
    _l1 := pgmnemo.ingest('tc_undo_con', 99997, 'deploy-gap',
        'When deploy gap occurs check uvicorn reload disable immediately',
        p_commit_sha => 'sha_uc_l1');
    _l2 := pgmnemo.ingest('tc_undo_con', 99997, 'deploy-gap',
        'When deploy gap occurs check uvicorn reload disable setting',
        p_commit_sha => 'sha_uc_l2');
    _l3 := pgmnemo.ingest('tc_undo_con', 99997, 'deploy-gap',
        'When deploy gap occurs uvicorn reload should be disabled',
        p_commit_sha => 'sha_uc_l3');
    PERFORM pgmnemo.ingest('tc_undo_con', 99997, 'api-error',
        'When API returns 500 always check the error logs first',
        p_commit_sha => 'sha_uc_l4');

    -- L1: canonical (highest recall_count=5)
    UPDATE pgmnemo.agent_lesson
    SET embedding    = ('[1.0' || repeat(',0.0', 1023) || ']')::vector(1024),
        recall_count = 5, confidence = 0.8
    WHERE commit_sha = 'sha_uc_l1';

    -- L2/L3: near-duplicates of L1
    UPDATE pgmnemo.agent_lesson
    SET embedding    = ('[0.9998,0.02' || repeat(',0.0', 1022) || ']')::vector(1024),
        recall_count = 2, confidence = 0.5
    WHERE commit_sha = 'sha_uc_l2';

    UPDATE pgmnemo.agent_lesson
    SET embedding    = ('[0.9999,0.01414' || repeat(',0.0', 1022) || ']')::vector(1024),
        recall_count = 1, confidence = 0.5
    WHERE commit_sha = 'sha_uc_l3';

    -- L4: perpendicular outlier — forms no cluster
    UPDATE pgmnemo.agent_lesson
    SET embedding    = ('[0.0' || repeat(',0.0', 1022) || ',1.0]')::vector(1024),
        recall_count = 0, confidence = 0.5
    WHERE commit_sha = 'sha_uc_l4';
END;
$$;
-- ── T2: apply consolidation ───────────────────────────────────────────────────
SELECT count(*) = 1 AS t2_consolidate_one_cluster
FROM pgmnemo.consolidate(0.92, false, 'tc_undo_con');
NOTICE:  table "_con_candidates" does not exist, skipping
NOTICE:  table "_con_pairs" does not exist, skipping
NOTICE:  table "_con_uf" does not exist, skipping
NOTICE:  table "_con_clusters" does not exist, skipping
 t2_consolidate_one_cluster 
----------------------------
 t
(1 row)

-- ── T3: 2 members superseded ─────────────────────────────────────────────────
SELECT count(*) = 2 AS t3_two_superseded
FROM pgmnemo.agent_lesson
WHERE role = 'tc_undo_con' AND state = 'superseded';
 t3_two_superseded 
-------------------
 t
(1 row)

-- ── T4: canonical evidence_count = 3 ─────────────────────────────────────────
SELECT evidence_count = 3 AS t4_evidence_count_three
FROM pgmnemo.agent_lesson
WHERE role = 'tc_undo_con' AND is_active AND evidence_count > 1;
 t4_evidence_count_three 
-------------------------
 t
(1 row)

-- ── T5: 2 SUPERSEDED_BY consolidation edges ──────────────────────────────────
SELECT count(*) = 2 AS t5_two_consolidation_edges
FROM pgmnemo.mem_edge e
JOIN pgmnemo.agent_lesson tgt ON tgt.id = e.target_id
WHERE tgt.role = 'tc_undo_con'
  AND e.relation_type = 'SUPERSEDED_BY'
  AND e.valid_until IS NULL
  AND e.metadata @> '{"consolidation":true}'::jsonb;
 t5_two_consolidation_edges 
----------------------------
 t
(1 row)

-- ── T6: edges carry prior_state key (v0.14.1 P1-A recording) ────────────────
-- prior_state = 'draft' (state assigned by ingest() for these test lessons)
SELECT count(*) = 2 AS t6_prior_state_key_recorded
FROM pgmnemo.mem_edge e
JOIN pgmnemo.agent_lesson tgt ON tgt.id = e.target_id
WHERE tgt.role = 'tc_undo_con'
  AND e.relation_type = 'SUPERSEDED_BY'
  AND e.valid_until IS NULL
  AND (e.metadata ? 'prior_state');
 t6_prior_state_key_recorded 
-----------------------------
 t
(1 row)

-- ── T7: dry-run reports 1 cluster (would-be-restored) ────────────────────────
SELECT count(*) = 1 AS t7_dryrun_one_cluster_reported
FROM pgmnemo.undo_consolidate(NULL, TRUE) u
JOIN pgmnemo.agent_lesson al ON al.id = u.canonical_id
WHERE al.role = 'tc_undo_con';
 t7_dryrun_one_cluster_reported 
--------------------------------
 t
(1 row)

-- ── T8: dry-run non-mutating — still 2 superseded ────────────────────────────
SELECT count(*) = 2 AS t8_dryrun_no_mutation_state
FROM pgmnemo.agent_lesson
WHERE role = 'tc_undo_con' AND state = 'superseded';
 t8_dryrun_no_mutation_state 
-----------------------------
 t
(1 row)

-- ── T9: dry-run non-mutating — edges unchanged ───────────────────────────────
SELECT count(*) = 2 AS t9_dryrun_no_mutation_edges
FROM pgmnemo.mem_edge e
JOIN pgmnemo.agent_lesson tgt ON tgt.id = e.target_id
WHERE tgt.role = 'tc_undo_con'
  AND e.relation_type = 'SUPERSEDED_BY'
  AND e.valid_until IS NULL
  AND e.metadata @> '{"consolidation":true}'::jsonb;
 t9_dryrun_no_mutation_edges 
-----------------------------
 t
(1 row)

-- ── T10: apply undo — returns 1 cluster ──────────────────────────────────────
SELECT count(*) = 1 AS t10_undo_one_cluster
FROM pgmnemo.undo_consolidate(NULL, FALSE) u
JOIN pgmnemo.agent_lesson al ON al.id = u.canonical_id
WHERE al.role = 'tc_undo_con';
 t10_undo_one_cluster 
----------------------
 t
(1 row)

-- ── T11: 0 superseded after undo ─────────────────────────────────────────────
SELECT count(*) = 0 AS t11_no_superseded_after_undo
FROM pgmnemo.agent_lesson
WHERE role = 'tc_undo_con' AND state = 'superseded';
 t11_no_superseded_after_undo 
------------------------------
 t
(1 row)

-- ── T12: all 4 lessons active ────────────────────────────────────────────────
SELECT count(*) = 4 AS t12_all_four_active
FROM pgmnemo.agent_lesson
WHERE role = 'tc_undo_con' AND is_active;
 t12_all_four_active 
---------------------
 t
(1 row)

-- ── T13: canonical evidence_count reset to 1 ─────────────────────────────────
SELECT count(*) = 0 AS t13_no_inflated_evidence_count
FROM pgmnemo.agent_lesson
WHERE role = 'tc_undo_con' AND evidence_count > 1;
 t13_no_inflated_evidence_count 
--------------------------------
 t
(1 row)

-- ── T14: members restored to prior state 'draft' (exact inverse) ─────────────
-- ingest() assigns state='draft' to these test lessons; undo restores exactly.
SELECT count(*) = 2 AS t14_members_restored_to_prior_state
FROM pgmnemo.agent_lesson
WHERE role = 'tc_undo_con'
  AND commit_sha IN ('sha_uc_l2', 'sha_uc_l3')
  AND state = 'draft'
  AND is_active;
 t14_members_restored_to_prior_state 
-------------------------------------
 t
(1 row)

-- ── T15: 0 consolidation edges remain ────────────────────────────────────────
SELECT count(*) = 0 AS t15_no_edges_remain
FROM pgmnemo.mem_edge e
JOIN pgmnemo.agent_lesson al ON al.id = e.target_id
WHERE al.role = 'tc_undo_con'
  AND e.relation_type = 'SUPERSEDED_BY'
  AND e.valid_until IS NULL
  AND e.metadata @> '{"consolidation":true}'::jsonb;
 t15_no_edges_remain 
---------------------
 t
(1 row)

-- ── T16: second undo is idempotent for this role ─────────────────────────────
SELECT count(*) = 0 AS t16_second_undo_noop
FROM pgmnemo.undo_consolidate(NULL, FALSE) u
JOIN pgmnemo.agent_lesson al ON al.id = u.canonical_id
WHERE al.role = 'tc_undo_con';
 t16_second_undo_noop 
----------------------
 t
(1 row)

-- ── Cleanup ───────────────────────────────────────────────────────────────────
DELETE FROM pgmnemo.agent_lesson WHERE role = 'tc_undo_con';
-- ════════════════════════════════════════════════════════════════════════════
-- P2-C: multi-canonical undo — undo_consolidate() must restore ALL clusters
-- ════════════════════════════════════════════════════════════════════════════
--   T17: consolidate 'tc_undo_multi' → 2 clusters formed
--   T18: 2 members superseded (one per cluster)
--   T19: undo_consolidate(NULL, FALSE) returns 2 clusters
--   T20: 0 superseded after multi-undo
--   T21: all 4 lessons active
--   T22: all evidence counts reset to 1
-- Setup: two independent clusters in 'tc_undo_multi', project_id 99990.
-- Cluster A embeddings → e1-direction [1, 0, …]; Cluster B → e2-direction [0, 1, 0, …].
-- Cross-cluster cosine similarity ≈ 0 (orthogonal) — clusters are independent.
DO $$
DECLARE _l1 BIGINT; _l2 BIGINT; _l3 BIGINT; _l4 BIGINT;
BEGIN
    _l1 := pgmnemo.ingest('tc_undo_multi', 99990, 'cluster-a',
        'When deploying always run alembic upgrade head first',
        p_commit_sha => 'sha_um_l1');
    _l2 := pgmnemo.ingest('tc_undo_multi', 99990, 'cluster-a',
        'When deploying always run alembic upgrade head before starting',
        p_commit_sha => 'sha_um_l2');
    _l3 := pgmnemo.ingest('tc_undo_multi', 99990, 'cluster-b',
        'When psycopg2 errors occur check connection pooling configuration',
        p_commit_sha => 'sha_um_l3');
    _l4 := pgmnemo.ingest('tc_undo_multi', 99990, 'cluster-b',
        'When psycopg2 connection errors occur always check pool settings',
        p_commit_sha => 'sha_um_l4');

    -- Cluster A: e1-direction, cosine sim ≈ 0.9998 (above threshold 0.92)
    UPDATE pgmnemo.agent_lesson
    SET embedding    = ('[1.0' || repeat(',0.0', 1023) || ']')::vector(1024),
        recall_count = 5, confidence = 0.8
    WHERE commit_sha = 'sha_um_l1';

    UPDATE pgmnemo.agent_lesson
    SET embedding    = ('[0.9998,0.02' || repeat(',0.0', 1022) || ']')::vector(1024),
        recall_count = 1, confidence = 0.5
    WHERE commit_sha = 'sha_um_l2';

    -- Cluster B: e2-direction, cosine sim ≈ 0.9998; orthogonal to Cluster A
    UPDATE pgmnemo.agent_lesson
    SET embedding    = ('[0.0,1.0' || repeat(',0.0', 1022) || ']')::vector(1024),
        recall_count = 5, confidence = 0.8
    WHERE commit_sha = 'sha_um_l3';

    UPDATE pgmnemo.agent_lesson
    SET embedding    = ('[0.02,0.9998' || repeat(',0.0', 1022) || ']')::vector(1024),
        recall_count = 1, confidence = 0.5
    WHERE commit_sha = 'sha_um_l4';
END;
$$;
-- ── T17: consolidate → 2 independent clusters ────────────────────────────────
SELECT count(*) = 2 AS t17_two_clusters_consolidated
FROM pgmnemo.consolidate(0.92, false, 'tc_undo_multi');
NOTICE:  table "_con_candidates" does not exist, skipping
NOTICE:  table "_con_pairs" does not exist, skipping
NOTICE:  table "_con_uf" does not exist, skipping
NOTICE:  table "_con_clusters" does not exist, skipping
 t17_two_clusters_consolidated 
-------------------------------
 t
(1 row)

-- ── T18: 2 members superseded (l2 from A, l4 from B) ────────────────────────
SELECT count(*) = 2 AS t18_two_superseded
FROM pgmnemo.agent_lesson
WHERE role = 'tc_undo_multi' AND state = 'superseded';
 t18_two_superseded 
--------------------
 t
(1 row)

-- ── T19: undo with no canonical filter restores both clusters ────────────────
SELECT count(*) = 2 AS t19_multi_undo_two_clusters
FROM pgmnemo.undo_consolidate(NULL, FALSE) u
JOIN pgmnemo.agent_lesson al ON al.id = u.canonical_id
WHERE al.role = 'tc_undo_multi';
 t19_multi_undo_two_clusters 
-----------------------------
 t
(1 row)

-- ── T20: 0 superseded after multi-undo ───────────────────────────────────────
SELECT count(*) = 0 AS t20_no_superseded_after_multi_undo
FROM pgmnemo.agent_lesson
WHERE role = 'tc_undo_multi' AND state = 'superseded';
 t20_no_superseded_after_multi_undo 
------------------------------------
 t
(1 row)

-- ── T21: all 4 lessons active ────────────────────────────────────────────────
SELECT count(*) = 4 AS t21_all_four_active
FROM pgmnemo.agent_lesson
WHERE role = 'tc_undo_multi' AND is_active;
 t21_all_four_active 
---------------------
 t
(1 row)

-- ── T22: all evidence counts reset to 1 ──────────────────────────────────────
SELECT count(*) = 0 AS t22_no_inflated_evidence_count
FROM pgmnemo.agent_lesson
WHERE role = 'tc_undo_multi' AND evidence_count > 1;
 t22_no_inflated_evidence_count 
--------------------------------
 t
(1 row)

-- ── Cleanup ───────────────────────────────────────────────────────────────────
DELETE FROM pgmnemo.agent_lesson WHERE role = 'tc_undo_multi';
